{"automatic_mutation_allowed":false,"current_main_revision":"293de53489fe7212fad272c01c698c0ffe2da610","decision_gates":[{"change_id":"AIGC-ISSUE-66","number":66,"state":"OPEN","title":"governance(jobs): ratify canonical lifecycle semantics and PR #64 disposition"}],"excluded_changes":[{"branch":"codex/pr-dependency-graph-v1","change_id":"AIGC-PR-75","notes":"PR #75 is observed but excluded from the committed graph node set because committing its own final head would make the graph immediately stale.","reason":"SELF_REFERENTIAL_IMPLEMENTATION_CHANGE"}],"external_action_performed":false,"observed_at":"2026-07-13T14:25:07Z","operator_id":"Justice Gray Maciocha","operator_review_required":true,"pull_requests":[{"base_branch":"main","base_revision":"293de53489fe7212fad272c01c698c0ffe2da610","branch":"codex/pr-dependency-graph-v1","change_id":"AIGC-PR-75","draft":true,"head_revision":"ced4801f982fdd0d3b8977cc6ae261807a995be2","mergeable":true,"number":75,"state":"OPEN","title":"feat(governance): add PR graph, refresh evidence, and review saturation gate"},{"base_branch":"main","base_revision":"293de53489fe7212fad272c01c698c0ffe2da610","branch":"codex/ci-action-sha-pinning-main-v1","change_id":"AIGC-PR-74","draft":true,"head_revision":"db59f635cdab05b43c49dde828ee720e5bc61bea","mergeable":true,"number":74,"state":"OPEN","title":"fix(ci): pin actions and harden trigger, evidence, and invocation gates"},{"base_branch":"main","base_revision":"293de53489fe7212fad272c01c698c0ffe2da610","branch":"codex/evolution-engine-single-snapshot-v1","change_id":"AIGC-PR-72","draft":true,"head_revision":"08e0c1d2d0f043e07f329ca49528d01b8e26a5eb","mergeable":true,"number":72,"state":"OPEN","title":"fix(engine): make evolution execution honestly single-snapshot"},{"base_branch":"main","base_revision":"293de53489fe7212fad272c01c698c0ffe2da610","branch":"codex/ci-dual-revision-evidence-gate-v2-procedure","change_id":"AIGC-PR-71","draft":true,"head_revision":"e17d11e02d02f886896c1bdace042a28ccf739dd","mergeable":true,"number":71,"state":"OPEN","title":"docs(ci): procure dual-revision evidence gate procedure v2"},{"base_branch":"main","base_revision":"293de53489fe7212fad272c01c698c0ffe2da610","branch":"codex/readiness-ledger-transactional-persistence-reconciliation-v1","change_id":"AIGC-PR-70","draft":true,"head_revision":"09da1a4b9ddc2b6d4036167c361437bd3e6f56ab","mergeable":true,"number":70,"state":"OPEN","title":"fix(readiness): reconcile transactional persistence evidence"},{"base_branch":"main","base_revision":"293de53489fe7212fad272c01c698c0ffe2da610","branch":"codex/ci-dual-revision-evidence-gate-v2-current-main","change_id":"AIGC-PR-69","draft":true,"head_revision":"5e814314eeb8a12f335d214e93a11ac6d8204c34","mergeable":true,"number":69,"state":"OPEN","title":"fix(ci): separate exact-head evidence from merge-candidate validation"},{"base_branch":"main","base_revision":"293de53489fe7212fad272c01c698c0ffe2da610","branch":"codex/aigc-operations-codex-manual-library-v1","change_id":"AIGC-PR-68","draft":true,"head_revision":"be785d1d32da818cd5560f78cba5e8f4d156e88a","mergeable":true,"number":68,"state":"OPEN","title":"docs(manuals): procure Operations Codex manual library v1"},{"base_branch":"main","base_revision":"293de53489fe7212fad272c01c698c0ffe2da610","branch":"codex/canonical-job-lifecycle-contract-v1","change_id":"AIGC-PR-65","draft":true,"head_revision":"cadebce117f2707bd538153b452b8f4af1541e20","mergeable":true,"number":65,"state":"OPEN","title":"docs(jobs): reconcile canonical job lifecycle contract v1"},{"base_branch":"main","base_revision":"293de53489fe7212fad272c01c698c0ffe2da610","branch":"codex/governed-job-state-machine-v1","change_id":"AIGC-PR-64","draft":true,"head_revision":"4ee974d1f6f3be634a5c610aac5e998e01aaf6e3","mergeable":true,"number":64,"state":"OPEN","title":"feat(jobs): add governed job state-machine kernel"},{"base_branch":"main","base_revision":"293de53489fe7212fad272c01c698c0ffe2da610","branch":"codex/persistent-authorization-receipts-api-v1","change_id":"AIGC-PR-63","draft":true,"head_revision":"02aef5859e17719ce4cfecfa784bd957f8aefbe9","mergeable":true,"number":63,"state":"OPEN","title":"feat(api): persist authorization receipts across restart"},{"base_branch":"main","base_revision":"1bb9f39e12bb2fe1f229462c1c25b59b95e952bc","branch":"codex/aigc-chatlog-master-upgrades-20260708","change_id":"AIGC-PR-21","draft":true,"head_revision":"aab2604c2987a5f037b2587feec516e4ed27688e","mergeable":true,"number":21,"state":"OPEN","title":"Ingest AIGC chat-log master upgrades"},{"base_branch":"main","base_revision":"9b7ce1f71fd98ea561e280306ca17caa34968326","branch":"codex/sssxr-governed-protocol","change_id":"AIGC-PR-15","draft":true,"head_revision":"adadb49e6c3edd89b7a5a876d101cce232cb27d7","mergeable":true,"number":15,"state":"OPEN","title":"Add governed SSSXR autonomic work protocol"},{"base_branch":"main","base_revision":"d15400e57a27308620ebc29109e80aa0257f3edc","branch":"codex/milestone-l-truth-first-procurement-governance","change_id":"AIGC-PR-11","draft":true,"head_revision":"4ed7a67ad122a2b458f3502a0149a64d63e36ad3","mergeable":false,"number":11,"state":"OPEN","title":"[codex] Instantiate Milestones L-R governed renewal and architecture kernel"}],"repository":"Lornt1666/AIGC","schema_version":"1.0.0","snapshot_id":"AIGC-PR-PLATFORM-SNAPSHOT-001","source":"GITHUB_CONNECTOR_READ_ONLY"}
